skillempresa,fillImportante empresa financiera requiere Analista Programador  Principales Funciones:  Participar en el levantamiento de...
Empresa que presta servicios a grandes clientes del área de Retail, requiere incorporar a su equipo Analista... 
Buscamos Ingenierio en Java, que tenga motivación para trabajar en una empresa dedicada a monitorio satelital de... 
En Atianza estamos en búsqueda de un ingeniero de Software para asumir las labores de: 0. Análisis Diseño,... 
Importante Empresa Líder de Mercado en Tecnologías de la información (Software) requiere para su staff de... 
En Emergya Chile nos encontramos en la búsqueda de Desarrollador Java Junior, desde 2 año de experiencia en el área... 
Reconocido Holding con más de 20 años de presencia en el mercado nacional, busca un Desarrollador Java Junior... 
Reconocida empresa de Tecnología ubicada en Santiago Centro, se encuentra en búsqueda de Desarrollador Java por... 
Para importante proyecto bancario, nos encontramos en la búsqueda de un Desarrollador para realizar funciones... 
Reconocida empresa, se encuentra en la búsqueda de DESARROLLADOR - JAVA EXPERTO para trabajar en Santiago Centro por... 
Reconocido Holding con más de 20 años de presencia en el mercado nacional, busca un Desarrollador Java que tenga... 
Nos encontramos en la búsqueda de un Analista Programador con experiencia en desarrollo web, para participar en un... 
En Zenta Group estamos en la búsqueda de un Desarrollador Back-End que ejecute las siguientes funciones: - Brindar... 
Empresa de desarrollo de software busca a Arquitecto Java con conocimientos en plataformas Cloud (deseable GCP). ... 
Somos facilitadores tecnológicos, comprometidos con la calidad de nuestras soluciones y la satisfacción de nuestros... 
para importante entidad financiera ubicada en stgo Centro, requiere contratar por un proyecto de 6 meses a... 
Para laborar en importante empresa del Rubro Bancario en Proyecto de 4 a 6 meses se busca Desarrollaodor java, con el... 
Apiux empresa de tecnología con foco a las soluciones tecnológicas para la vida de hoy, se encuentra en búsqueda de un... 
Buscamos cuatro Desarrollares Java para importante proyecto de salud que cumpla los siguientes requisitos: - Lenguaje... 
Azurian compañía transnacional especializada en consultoría estratégica y servicios tecnológicos, líder en el mercado... 
